ID,TIF DISTRICT,PROJECT NAME,ADDRESS,DEVELOPER,PROJECT ID,PROJECT DESCRIPTION,CDC DATE,APPROVED AMOUNT,TOTAL PROJECT COST,X COORDINATE,Y COORDINATE,LATITUDE,LONGITUDE,LOCATION,Boundaries - ZIP Codes,Community Areas,Zip Codes,Census Tracts,Wards,:@computed_region_awaf_s7ux
500278,Western Avenue North,IGA - CPD - Welles Park,2333 W Sunnyside Av,Chicago Park District,,An intergovernmental agreement between the City of Chicago and Chicago Park District.,5/6/14,1300000,1300000,1159833.188,1929783.384,41.96304075,-87.68773712,"(41.96304074988563, -87.68773711730951)",20,6,21849,667,18,13
500468,West Irving Park,Merrimac Park,6343 W Irving Park Rd,Chicago Park District,,An intergovernmental agreement between the City of Chicago and Chicago Park District.,4/25/12,615000,615000,1133179.255,1925871.599,41.95281566,-87.78582729,"(41.95281566373787, -87.78582729161174)",52,17,22254,443,19,25
1676,47th/Ashland,Goldblatt's Sr Living,4700 S Ashland Av,Goldblatts of Chicago L.P.; and AHC Ashland LLC,1068,"Located in the New City community, Goldblatt's Senior Living is a 101-unit supportive living facility for frail elderly aged 65 and over.  The existing building, formerly a Goldblatts department store, will have seventy studio apartments, sixteen one bedroom apartments, and fifteen two bedroom apartments.  The affordable rental project provides 91 units for households earning no more than 60 percent of the area median income.",4/12/11,2900000,28310014,1166423.624,1873520.235,41.8085116,-87.66511729,"(41.8085115972472, -87.66511729173287)",37,59,14924,740,4,53
1409,Eastman/North Branch,Tru-Vue,1315 N North Branch St,"Tru Vue, Inc.",276,"Located in the Near North community area, the project includes rehabilitation  of an existing building and construction of a 40,000 square foot building.",8/10/93,620000,4854000,1168524.467,1908707.605,41.90502366,-87.65639437,"(41.90502366191824, -87.65639437158833)",49,37,22620,108,46,16
500093,Belmont/Cicero,Cicero And George Senior Housing,4800 W George St,Hispanic Housing Development Corporation,,"This proposed project, which will be located in the Belmont-Cragin community area, will consist of new construction of a six-story, 70 unit building for seniors age 55 and over.  Of the 70 units, 61 will be for seniors whose incomes range between 30-60% of area median income (AMI), eight will be for seniors whose incomes range at or below 80% AMI and one will be set-aside as a janitors' apartment.  The unit mix consists of one studio, 64 one-bedroom and five two-bedrooms.  In addition to the units, the building will contain a community room, exercise/wellness room, atrium, community garden, terrace and laundry room.  There will also be a total of 23 on-site parking spaces.  Additionally, the building will contain a water retention system, green roof, permeable pavers, and double glazed low ""E"" coated windows.  The total development costs for this project is $21,075,896, which computes to $301,084 per unit. 
 
SOURCES:                                                                            USES: 
TIF (Belmont/Cicero)       $4,000,000                                      Acquisition                   $ 2,789,000 
HED Loan Funds                5,186,787                                    Construction                  14,888,633 
FHLB AHP                            420,000                                     Soft Costs                       1,857,400 
DCEO Grant                         320,000                                     Developer Fee                 1,000,000 
Syndicator Equity*           10,925,000                                     Reserves                           540,863 
Com-Ed Grant                        33,666 
Geo-thermal Grant               115,343 
ICEF Grant                            75,000 
G.P. Equity                                 100 
 
*City 9% LIHTCs of $1,150,000 with a proposed pay-in rate of $0.95/$1.00. 
 
Square footage totals:          Building gross - 69,390; building net - 48,236 
Construction costs:               Per gross s.f. - $214.56; per net s.f. - $308.66 
Total development costs:      Per gross s.f. - $303.73; per net s.f. - $436.93 
 
DEVELOPMENT TEAM: 
Developer - Hispanic Housing Development Corp. 
Owner - Cicero and George Limited Partnership 
Architect - Weese Langley Weese 
G.C. - Tropic Construction 
Attorney - Applegate and Thorne Thomsen 
Equity Syndicator - TBD",6/10/14,4000000,22175624,1143845.624,1918889.671,41.93346293,-87.74679225,"(41.933462930579694, -87.74679224681145)",21,19,22618,355,17,7
10710,Bryn Mawr/Broadway,IGA - CTA - Bryn Mawr Red Line,1119 W Bryn Mawr Av,Chicago Transit Authority,,Agreement between the City of Chicago and the Chicago Transit Authority,5/24/13,10000000,25000000,1167635.951,1937312.419,41.98353575,-87.65883132,"(41.983535745183424, -87.65883131820925)",15,76,22616,145,16,40
1656,River South,IGA - CPD - Park 0481 - Ping Tom - II,300 W 19th St,Chicago Park District,1042,Intergovernmental Agreement between the City of Chicago and the Chicago Park District,3/10/10,22000000,22000000,1174799.835,1891209.052,41.85686837,-87.63386709,"(41.856868370692965, -87.63386708568844)",40,35,21194,3,26,8
11654,Montrose/Clarendon,Montrose Clarendon TIF,4400 N Clarendon Av,Harlem Irving Co. & JDL Development Corp.,,"Located in the Uptown community area, the project will redevelop the currently vacant Columbus-Maryville site. The portion of the property on the west side of North Clarendon Avenue will be redeveloped with a 26-story mixed-use building with 381 residential units, including 20 affordable units, and a grocery store of approximately 30,511 square feet at the building's  base along with 278 enclosed parking spaces. The property on the east side of North Clarendon Avenue will include a new 1-story building, consisting of approximately 5,900 square feet of retail space with 11 exterior parking spaces. 10 units will be set aside for Low Income Families whose annual income does not exceed 50% AMI and 10 units will be set aside for Low Income families whose annual income does not exceed 60% AMI.",1/12/16,15880000,125044198,1170083.621,1929442.158,41.9618863,-87.65006015,"(41.9618863012381, -87.65006014985424)",15,31,21186,20,39,37
10627,Homan/Arthington,UCAN CITY TIF,3600 W Fillmore St,Uhlich Children's Advantage Network,,"The proposed project consists of the new construction of a 7 acre Chicagoland institute for transforming youth (CITY) campus.  This development will include two buildings, recreational and open green space, total parking includes 103 spaces. One building will house a three-story, 54,500 square- foot youth home with a maximum of 70 beds. Each living unit will include small kitchens and group rooms. Plans also include a music room, art therapy room, media room and game room. This building will also have an indoor gymnasium and weight room.

The second building will house a two-story 31,200 square foot program office to provide expanded outreach services focusing on areas case management, family support services, workforce development, clinical and counseling services, mentoring and violence interruption/prevention.  
The development will also consist of outdoor recreation space that will include green space and an athletic field.  Both buildings will use energy efficient building construction.",9/10/13,2500000,39086515,1152501.662,1895174.475,41.86821925,-87.71560912,"(41.86821925121685, -87.71560911661228)",30,30,21572,98,14,36
1663,Lawrence/Pulaski,Thai Town Center,4461 N Pulaski Rd,Thai Town Center Inc,1050,"The Thai Town Center project is located in the Lawrence/Pulaski TIF district.  The project consists of the rehabilitation and adaptive reuse of the former 17th district police station. The project includes about 6,000 square feet of commercial/retail space.",9/14/10,1506306,3365730,1148957.377,1929594.372,41.96273998,-87.72772872,"(41.96273998329415, -87.72772872228448)",20,14,21869,117,12,28
10711,35th/Halsted,Vienna Beef,1000 W Pershing Rd,"Vienna Beef, Ltd.",,"The Vienna Beef project is located in the 35/Halsted TIF district. This project consists of the acquisition, relocation and renovation of the Vienna Beef manufacturing facility. The facility will be relocated from 2501 N. Damen to an existing under-utilized 103,445 square feet facility within the TIF district located at 1000 West Pershing Road.",6/11/13,4970000,12268346,1170253.47,1879012.726,41.82350098,-87.65091032,"(41.82350097872139, -87.65091031737369)",37,58,14924,172,48,26
10970,Lawrence/Broadway,Leland Hotel,1201 W Leland Av,Leland L.P.,,"Located in the Uptown community, the project consists of rehabilitating a 75,000 square foot six-story building.  The building will include 137 apartments and rental commercial space on first floor.",2/25/02,2000000,14774804,1167441.321,1931316.652,41.96708739,-87.65972052,"(41.96708738517241, -87.65972052321467)",15,31,22616,611,39,37
500080,Woodlawn,The Strand,6315 S Cottage Grove Av,"Historic Strand, LP",,"The former Strand Hotel is a city-owned building located at 6315 S. Cottage Grove.  The developer, Holsten R.E. Development is seeking to rehabilitate the existing building into affordable multifamily housing targeting veterans and others with household incomes at or below 60% of AMI.  The Strand is a five story brick structure with stone accents.  Upon completion the development will include 62 one-bedroom units and 1 two-bedroom managers unit.  The site also includes an adjacent vacant parcel in the rear of the building, at 6314 S. Maryland, that will be redeveloped into a parking lot with an estimated 28 parking spaces.",4/8/14,2000000,22916932,1182690.738,1863235.377,41.7799265,-87.60577294,"(41.779926504277796, -87.60577293833379)",60,9,22260,347,4,53
11073,Humboldt Park Commercial,IGA - CBE - Jose De Diego Elementary,1313 N Claremont Av,Chicago Public Schools,,Jose De Diego Elementary School -  IGA pending,5/1/13,400000,552000,1160540.669,1908752.314,41.90531549,-87.68572006,"(41.905315488660484, -87.6857200549393)",4,25,21560,516,41,24
11047,Western/Ogden,IGA - CBE - Plamondon 2013,2642 W 15th Pl,Chicago Public Schools,,CPS - Plamondon - IGA pending,8/12/13,3000000,3000000,1158816.302,1892329.996,41.86028668,-87.69250468,"(41.86028667955628, -87.6925046809117)",43,30,14920,16,23,11
1543,Western Avenue South,N. Center Sr. - Park - TACH,4040 N Oakley Av,TACH Development Company LLC,723,"Located in the North Center community, the project developed two park.  The Central Green Park is 20,000 square feet and Corner Park is 7,600 square feet.  Both parks include grassy open areas, walkways, benches, lighting, landscaping, and a fountain.",3/12/08,1165000,2468000,1160265.995,1926956.209,41.95527387,-87.68622434,"(41.95527387396927, -87.6862243362722)",39,46,21538,623,18,13
13404,North Pullman,IGA - CPD - Gately Park,810 E 103rd St,Chicago Park District,,"Chicago Park District will construct; (i) the area's first hydraulically-banked 200-meter track, (ii) seating capacity for 3,500 individuals, (iii) an approximately 4,000 square foot warm up area, eight sprint lanes, two long and triple jump runways and pits, pole vaults and pads, high jump area and scoreboards; and (iv) an approximately 22,000 square foot designated space within the facility for ""After School Matters"" programming which will be used for dance programs, multi-purpose labs for art, science and technology, and full culinary kitchen for cooking classes.",11/14/18,10000000,56671818,1183518.959,1836886.446,41.70760293,-87.60355582,"(41.70760292545987, -87.60355582183975)",19,47,21861,643,35,9
1028,LaSalle Central,United Airlines Headquarters,233 S Wacker Dr,"UAL Corp. and United Airlines, Inc.",788,"Located in the Loop, the project includes renovation of approximately 400,000 square feet of office and lobby space for the United Airlines Headquarters.",9/8/09,25889768,71786650,1174011.902,1899107.617,41.87856015,-87.63652387,"(41.87856015362371, -87.63652387205532)",46,38,14914,92,36,48
1237,Central Loop,IGA - CTA - Block 37,108 N State St,Chicago Transit Authority,11,"Located in the Loop, the Chicago Transit Authority constructed a new four level below grade structure for use as CTA station.  The station also includes 26,000 square feet of retail space and some off-block track improvements.",10/13/06,42350000,158150000,1176312.76,1900898.416,41.88342264,-87.62802165,"(41.88342263701488, -87.62802165207536)",41,38,14310,92,36,22
1299,Kinzie Industrial Corridor,Nanoink,1337 W Randolph St,"Nanoink, Inc.",101,"The project includes rehabilitation of a 46,400 square foot laboratory, the mechanical engineering, and office building.",8/13/02,1000000,5940753,1167507.742,1901068.1,41.88408229,-87.66034921,"(41.884082288513554, -87.66034920815707)",44,29,14917,63,46,41
1758,Western/Ogden,IGA - CPD - Park 0400 - Claremont,2334 W Flournoy St,Chicago Park District,2111,An Intergovernmental Agreement Between the City of Chicago and the Chicago Park District,10/3/12,250000,500000,1160767.154,1897031.065,41.87314668,-87.68521331,"(41.87314668437623, -87.68521330710944)",28,29,21184,757,23,48
1717,47th/King Drive,IGA - CBE - ADA - Attucks,5055 S State St,Chicago Public Schools,1152,An intergovernmental agreement between the City of Chicago and the Chicago Board of Education regarding accessibility improvements.,4/13/11,1000000,1003000,1177176.077,1871285.644,41.80214349,-87.6257474,"(41.80214349010087, -87.62574740239889)",10,4,21192,449,9,12
1417,Near North,North Town Village II,1421 N Halsted St,NTV Limited Partnership,284,"Thirty-two (32) buildings to be located on Lots 2, 4-25, 27-30 and 33-36 in the Plat of Subdivision of North Town Village Chicago, Illinois, and which shall contain, as of the completion of construction thereof, 145 multi-family residential dwelling units, 40 of which will comprise the Low-Income Project. The 40 CHA units to be financed with HOME Funds and required to be occupied by Low-Income Families.",10/12/99,8600000,55000000,1170794.987,1909451.505,41.9070155,-87.64803227,"(41.907015495773344, -87.6480322734244)",54,37,22620,108,46,41
1616,Fullerton/Milwaukee,Sachs Hairpin - Lofts,3414 W Diversey Av,"Hairpin Lofts, LLC and Brinshore 2008 Corp.",941,The Sachs Hairpin Lofts project is located in the Fullerton/Milwaukee TIF District. The project consists of the rehabilitation of a 6-story building containing 28 residential rental units. 25 units will be affordable.,11/27/09,7151770,11062899,1153078.89,1918447.998,41.93207259,-87.71287204,"(41.93207259354385, -87.71287203813056)",39,22,22535,55,12,15
1461,Northwest Industrial Corridor,Brach's - 401 N Cicero,401 N Cicero Av,MLRP 401 Cicero LLC,408,Construct 520k sf LEED certified distribution / light industrial facility with 200 parking spaces,1/8/08,10600000,42676609,1144336.566,1902310.797,41.88795951,-87.74540567,"(41.887959508176415, -87.74540566874559)",32,26,22216,695,23,11
1327,26th/King Drive,Mercy Hospital,2525 S Michigan Av,Mercy Hospital and Medical Center,142,"Located in the Near South Side community area, this project is for the rehabilitation of the main campus hospital building, site preparation for the sale of the eastern portion of the site for residential development, and other costs associated with the acquisition and environmental remediation for hospital parking rehab hospital, site prep, environmental remediation.",12/13/05,38000000,263151638,1177690.144,1887533.373,41.84671696,-87.62336973,"(41.84671695664648, -87.62336972761213)",40,34,21194,193,10,48
13148,Near North,Parkside Four Phase II,1029 N Cleveland Av,Holsten Real Estate Development,,"As one of CHA's Plan Forward developments, Parkside Four Phase II will be the last rental phase of the Parkside of Old Town development.  The Parkside of Old Town development, which is located in the Near North Community area, spans from Division on the north, Orleans on the east, Larrabee on the west, and Oak Street on the south. To date, 592 units of mixed-income rental and for-sale housing has been erected on site in a combination of mid-rises, walk-ups, town homes and condominiums.  Of the 592 units, 175 are CHA/PH units, 148 are affordable to households at the 60% AMI levels and below, and 269 are for market rate tenants.
 
This phase will consist of new construction of 134 mixed-income rental units that range from studios, up-to four-bedrooms, and will be housed in a combination of two- and three-story walk-ups, town homes, and a seven story mid-rise building. Of the 134 units, 69 will be housed in the mid-rise structure, 32 in town homes, and 33 in two, three-story walk-ups. The CHA/PH, as well as affordable units will rent to tenants at the 80% AMI and below levels.  Additional amenities will include off-street parking, outdoor spaces and community space.  All of the land is CHA-owned, and CHA will issue a long-term ground lease.  

Holsten Real Estate Development is the developer and has been for all of the Parkside of Old Town phases.",1/15/19,12000000,61055285,1172730.099,1907421.998,41.90140378,-87.64098402,"(41.90140377678921, -87.6409840191962)",54,37,14926,148,46,41
1315,43rd/Cottage Grove (DOH),Hearts Multi-Family 3,550 E 41st St,Hearts United Phase lll L.P.,120,"Located in Grand Boulevard, the project includes construction of two row houses and seven six-flats on 9 sites, which total 53 residential units.  Of the 53 units, 87% are affordable housing at 60% area median income.",10/23/01,1469000,10983652,1180901.323,1877976.585,41.82041901,-87.61187953,"(41.82041900967597, -87.61187952486645)",36,4,4301,583,10,1
1316,Archer Courts,Archer Courts - Phase I - Apts,2242 S Princeton Av,Community Housing Partners XV L.P.; Chicago Community Development Corp.; et Voice of the People,121,"Located in Armour Square, the project includes the rehabilitation of two apartment buildings.  The buildings will have 147 units with 145 of those units affordable at 60% area median income.",1/12/99,2500000,11040129,1174528.583,1889278.897,41.85157794,-87.63492035,"(41.85157794309647, -87.63492034466017)",40,35,21194,3,26,8
11072,Foster and California,IGA - CBE - Budlong Elementary,2701 W Foster Av,Chicago Public Schools,,"An Intergovernmental Agreement with the Board of Education of the City of Chicago in order to provide Tax Increment Financing (TIF) to reimburse the Chicago Board of Education for the costs associated with the complete renovation of bathrooms at Budlong Elementary School. This project includes the complete demolition and replacement of new bathrooms on the first, second and third floors of the school to provide modern accessibility and bring the facility into current code compliance.",9/24/15,2200000,2200000,1157387.173,1934388.087,41.97572652,-87.69660443,"(41.97572651851171, -87.69660442713682)",20,6,21849,28,24,46
1723,Midwest,IGA - CBE - ADA - Lawndale,3500 W Douglas Bv,Chicago Public Schools,1158,An intergovernmental agreement between the City of Chicago and the Chicago Board of Education regarding accessibility improvements.,4/13/11,2500000,2500845,1153224.421,1893272.908,41.86298684,-87.71300615,"(41.862986834878505, -87.71300615142987)",57,30,21569,772,14,36
12918,116th/Avenue O,Avenue O,11739 S Burley Av,Northpoint Development,,"The Developer is planning to develop a state-of-the-art business park in 3 phases. Phase 1 would consist of approximately 940,000 square feet, Phase 2 would consist of approximately 740,000 square feet, and Phase 3 would consist of approximately 580,000 square feet.",10/9/18,42400000,164459066,1199625.852,1827555.141,41.68160723,-87.54488594,"(41.68160722944379, -87.54488594067055)",25,52,21202,787,47,47
1292,Canal/Congress,550 W Adams - USG,550 W Adams St,550 Adams LLC,86,"The project consists of construction of an 18-story, 471,000 square feet office building for USG corporate headquarters and their affiliates.  The project will also have an 11,000 square feet green roof and LEED certification.",4/13/04,9750000,132340000,1172619.94,1899399.792,41.8793928,-87.64162618,"(41.87939279810978, -87.64162617690114)",45,29,4452,786,36,48
1242,119th/I-57,Renaissance Estates,1555 W 122nd St,JTA Development,18,The project will construct 86 housing units including 80 condominiums and six single family homes.  20% of the units will be affordable units at 100% area median income.,2/11/03,3600000,18411668,1167941.369,1823770.689,41.6719592,-87.66097617,"(41.671959201963354, -87.66097616459349)",13,50,22212,662,22,45
502011,Western/Rock Island,Buona Beef,10633 S Western Av,Keystone Ventures LLC,,"Located in the Beverly Community, Beverly Western Partners/Buona Beef project includes is a 3,940 SF restaurant with drive-through service, a 2,100 SF retail building, and 28 off-street parking spaces. This TIF assistance request is in the amount of no more than $450K and will assist in the construction of new retail development within the Western/Rock Island TIF. The project will include the demolition of 3 existing buildings and the development of two commercial buildings and parking for 28 vehicles. The total project cost is $2.8 million.  The project is expected to generate approximately 50- 60 new jobs.

Beverly Western Partners LLC  is owned by Keystone Ventures, LLC (principal is Timothy Hague) and 1419 Properties, LLC (principal Carlo Buonavolanto )",6/10/14,450000,2846974,1162320.536,1833913.035,41.69991014,-87.68126757,"(41.69991014337247, -87.68126756737111)",13,71,22212,609,42,33
13244,Western Avenue North,Amundsen High CPS IGA Winnemac Impr,5110 N Damen Av,Chicago Public Schools,,"This is an intergovernmental agreement between DPD and CPS to use TIF financing to rehabilitate the athletic fields field at Amundsen High School. 

The field is located in  Winnemac Park in the Lincoln Square neighborhood    

The project installed  a 5,000 square foot synthetic turf featuring:
--new drainage 
--concrete containment curbing
--landscape improvements

The project was completed in August 2018 at a cost of 
$2,800,000 with $1,400,000 or 50% coming form TIF and the remaining funding coming from a $1,000,000 donation and $400,00 for the Chicago Board of Education",6/27/18,1400000,2800000,1162034.157,1934187.196,41.97507922,-87.67952139,"(41.97507921514951, -87.67952139085273)",20,6,21849,106,24,13
1489,Central West,Rush University Medical Center,1611 W Harrison St,Rush University Medical Center,602,"Rush University Medical Center is a major medical center on the west side.  The project is a multi-phased expansion/rehabilitation of their campus, which includes: demolition and replacement of 7 obsolete structures; renovation of 7 buildings; design and construction of a new Patient Care Tower, a 213,000 square foot Ambulatory Care Center, parking structure, central energy plant, loading docks and a new emergency room.",1/8/08,75000000,900701000,1165664.305,1897409.399,41.87408199,-87.66722276,"(41.874081988696005, -87.66722275934995)",28,29,21184,5,46,48
1352,Fullerton/Milwaukee,Florsheim - Footwear Factory,3927 W Belmont Av,Footwear Factory Development Corp,185,"Located in the Logan Square community, the project rehabilitated a 6-story building into 175 condominium units, and includes 35 affordable units with 80-100% area median income.  The project will also include approximately 6,500 square feet of commercial space, 191 parking spaces, and a green roof that will total 50% of the roof area.",6/14/05,8500000,55900000,1149797.37,1920953.645,41.93901283,-87.7248659,"(41.93901283171222, -87.72486590413378)",39,22,21538,215,21,7
1769,Jefferson Park,IGA - CPD - Park 0094 - Jefferson Memorial,4822 N Long Av,Chicago Park District,2122,"The TIF-Funded Improvements for the Project include the following: demolition of the existing playground, design of new playground, installation of drainage, utilities, surfacing, play equipment and furnishings, spray feature, and landscaping.""",6/20/11,600000,600000,1139458.138,1931593.737,41.96840534,-87.76260533,"(41.96840533730257, -87.76260532507628)",48,11,21869,129,50,20
1240,Central Loop,Majestic Bldg,18 W Monroe St,"Shubert Hotel Associates, LLC and Monroe Presentation, LLC",14,"Located in the Loop, the project includes subdividing a 20-story building known as ""Majestic Building"".The project consists of renovating the first five floors to a 2,000 seat performing arts theater and convert the top 15 floors from office space to hotel space.  No city funds are used for hotel conversion.",12/10/02,5564650,40537650,1176207.748,1899959.346,41.88084814,-87.62843558,"(41.880848142504874, -87.62843558025095)",34,38,14311,92,36,22
1301,Montclare,Montclare Sr Residence Belden Phase I,6650 W Belden Av,"Montclare Sr. Resid. Phase I, L.P.",103,"Located in Montclare, the project includes the construction of a 6-story senior residential building.  There building will include 153 rental units and 1 staff unit.  All rental units affordable at 60% area median income and age restricted of 55 or older, and include 47 units at 50% area median income.",8/8/00,4853000,21110808,1131547.932,1914379.416,41.92130822,-87.79209096,"(41.92130822275419, -87.79209095804886)",3,18,4454,136,7,39
1397,Chatham Ridge,87th Dan Ryan Shopping Center,112 W 87th St,L&O Partnership,259,"The project includes construction of an 186,000 square foot shopping center on a 14 acre site.  The project will also consist of 6 outlot buildings totaling 33,000 square feet, 700 parking spaces, and landscaping.",11/25/86,3151400,21706560,1176892.365,1847318.001,41.73638005,-87.62750922,"(41.736380045588184, -87.62750921902564)",59,40,21554,1,13,18
