ID,TIF DISTRICT,PROJECT NAME,ADDRESS,DEVELOPER,PROJECT ID,PROJECT DESCRIPTION,CDC DATE,APPROVED AMOUNT,TOTAL PROJECT COST,X COORDINATE,Y COORDINATE,LATITUDE,LONGITUDE,LOCATION,Boundaries - ZIP Codes,Community Areas,Zip Codes,Census Tracts,Wards,:@computed_region_awaf_s7ux
11837,Near West <Madison/Racine,Lake Street Studios RDA,727 W Lake St,Lake Street Studios Limited Partnership,,"Located in the Near West community, the project entails the construction of a nine-story 61 unit studio building for homeless and at risk homeless individuals. , The 61 affordable rental units are for individuals with incomes between 30% area median income and 60% area median income.",5/14/13,1289470,17463063,1171177.974,1901637.395,41.8855647,-87.64685508,"(41.88556470095639, -87.64685508324484)",45,29,4452,784,46,41
1379,95th/Western,Borders - 95th Western,9500 S Western Av,DB Beverly L.L.C.,228,"Located in the Beverly community area, the project includes construction of a shopping center with a 25,000 square foot bookstore and 118 parking spaces.",3/11/97,1600000,5922000,1162006.023,1841538.882,41.72084329,-87.68220805,"(41.72084329055877, -87.68220804837588)",,,4459,,,
11046,Near South <Central Station,IGA - CPD - South Grant Park Skate Park,1100 S Michigan Av,Chicago Park District,,"Improvements for the Project include design fees, site preparation and
demolition, drainage and utilities, landscape, earthwork, general construction, and event wheel
friendly area.",8/27/12,2500000,3000000,1177375.226,1895744.423,41.86925576,-87.6242766,"(41.86925575643569, -87.6242765954789)",35,38,14913,368,10,48
1436,Near North,River Village - Site G - Pointe,847 N Kingsbury St,"Kingsbury Larrabee, LLC",307,"Located in the Near North community, the project includes construction of a 7-story building with 102 condos including 11 affordable units at 100% area median income and 12 CHA units.  The project will also include 92 parking spaces, a green roof , and will have LEED Certification.",6/8/04,4950972,30455000,1172144.88,1906161.712,41.89795842,-87.64317081,"(41.89795841943221, -87.64317081074863)",54,37,14926,108,46,41
1275,Fullerton Normandy,Home Depot - Fullerton Normandy,2555 N Normandy Av,Home Depot Corp.,63,"Located in Montclare community area, the project includes demolishing an existing structure and constructing a 130,000 square foot single story Home Depot store.  The store will include a 28,000 square foot outdoor garden and 700 parking spaces.",9/14/93,3100000,17500000,1131355.386,1916424.97,41.92692481,-87.79275105,"(41.92692480560085, -87.79275104806534)",3,18,4454,136,7,39
1049,Stockyards Annex,815 W. Pershing,815 W Pershing Rd,"GFP Alliance Chicago, LLC",2063,"Located in the New City Community, 815 W. Pershing improves a recently constructed 104,000 square foot industrial building.  The industrial facility includes warehouse and distribution center which has tenants that include:  2020 Exhibits, Goodman Distribution, and US Government Drug Enforcement Agency.",10/23/12,917000,15115468,1171441.358,1878963.654,41.82334035,-87.64655385,"(41.82334034722429, -87.6465538473693)",37,59,14924,123,48,26
11718,Near North,IGA - CBE - Franklin,225 W Evergreen Av,Chicago Public Schools,,"Intergovernmental Agreement with the Board of Education of the City of Chicago in order to provide up to $410,000 in Tax Increment Financing (TIF) funds from the Near North TIF for the costs associated with the replacement of all damaged lockers at Franklin Elementary Fine Arts Center",7/29/15,410000,410000,1174204.012,1909317.563,41.90657253,-87.6355136,"(41.906572532817, -87.63551359944138)",54,37,14926,290,46,51
1369,South Works Industrial,Solo Cup,3333 E 87th St,Solo Cup Company,208,"Located in South Chicago community area, the project includes site remediation, construction of 1,000,000 square foot industrial facility, and construction of a railroad spur.",9/28/99,22090000,88450000,1199953.091,1847880.647,41.73737395,-87.54300522,"(41.73737394630549, -87.5430052178916)",25,42,21202,505,47,47
12124,Humboldt Park Commercial,Nancy Franco-Maldonado Paseo Boricua Arts Building,2709 W Division St,"Brinshore Development, LLC",,Includes the new construction of a mixed-use development with a performance art theater and commercial space on the ground floor and 24 live/work residential units above. The project will be located in the West Town Community Area and located in the Humboldt Park TIF District.  All units will be for tenants with incomes from 30% to 60% of AMI.,11/13/18,4245304,11772840,1158063.934,1907829.428,41.90283396,-87.69484316,"(41.90283396336296, -87.6948431570433)",4,25,21560,543,49,10
11065,Roosevelt/Cicero Industrial Corridor,IGA - CBE - Rockne Stadium lighting,1117 S Central Av,Chicago Public Schools,,CPS - Rockne Stadium lighting - IGA pending,9/4/13,700000,700000,1139307.198,1894636.296,41.86699274,-87.76406237,"(41.86699274439651, -87.76406236776494)",32,26,22216,61,7,52
1548,Howard/Paulina,IGA - CTA - Howard Station Project,1700 W Howard St,Chicago Transit Authority,732,An intergovernmental agreement between the CTA  and the City of Chicago.,6/11/08,4400000,82802000,1163652.173,1950386.071,42.01949533,-87.67311212,"(42.019495326202914, -87.67311212333439)",9,10,21853,340,5,3
500258,Central West,IGA - West Haven Park,1900 W Washington St,Chicago Park District,,An intergovernmental agreement between the City of Chicago and Chicago Park District.,1/15/14,3050000,3050000,1163693.735,1900750.315,41.88329148,-87.67436359,"(41.88329148185964, -87.67436358452834)",28,29,21184,579,46,41
1021,43rd/Cottage Grove (DOH),Mahogany Shops And Lofts At 47,747 E 47th St,Lofts 47 Phase 1 Limited Partnership,591,"The project in the Grand Boulevard community will consist of a five-story mixed-use residential and commercial building with parking for the 96 residential units.  The project will include construction of two six flats, one nine flat, and rehabilitation of an existing three flat building.  The ground floor level will include 55,000 square feet of retail space with Walmart committed to 41,000 square feet. 44 affordable units at no more than 60% of AMI. 28 public housing units for tenants anywhere from 0-60% of AMI.",7/10/12,12850000,45631627,1182241.946,1873977.257,41.80941355,-87.60708556,"(41.809413553160034, -87.60708556176535)",10,4,21192,165,10,1
11067,Pulaski Corridor,IGA - CBE - Ames Elementary,1920 N Hamlin Av,Chicago Public Schools,,Intergovernmental agreement with Chicago Board of Education for provision of Tax Increment Financing (TIF) assistance for improvements and grade expansion at Marine Leadership Academy at Ames School.,9/15/15,4500000,5108000,1150696.779,1912593.823,41.91605519,-87.72177945,"(41.91605519289756, -87.72177945326514)",1,23,22535,388,49,10
1771,Western/Ogden,IGA - CPD - Park ____ - Livingston Field,742 S Leavitt St,Chicago Park District,2125,An intergovernmental agreement between the City of Chicago and the Chicago Park District,5/1/11,3000000,3000000,1161799.672,1896610.376,41.87197082,-87.68143417,"(41.871970819966464, -87.6814341676415)",28,29,21184,5,23,8
12418,Ogden/Pulaski,IGA - CBE - ADA - Mason III,4217 W 18th St,Chicago Public Schools,,Intergovernmental Agreement between the City of Chicago and Chicago Board of Education,9/1/17,916931,916931,1148477.255,1891003.441,41.85685194,-87.73049117,"(41.85685194221634, -87.73049117213729)",57,30,21569,753,14,36
11551,51st/Lake Park,City Hyde Park TIF,5100 S Lake Park Av,Antheus Capital,,"The Developer intends to construct a mixed-use retail and residential development comprised of approximately 105,000 sq ft of retail, anchored by a 30,000 sq ft grocery store, as well as one residential tower above the Retail Space comprised of approximately 180 residential units (144 market rate and 36 affordable units), and an underground parking garage with a minimum of 350 spaces and containing certain green initiatives. The project will bring much needed retail and grocery to the Hyde Park area, as well as expand the number of affordable housing units. 72 market rate and 33 affordable units must be leased and occupied by CoC. At least 80% of the 36 residential units must be leased and occupied each year.",10/9/12,11321242,113445664,1187472.987,1871458.763,41.80237973,-87.58797941,"(41.802379729614486, -87.58797940662785)",10,8,21192,405,10,1
1664,Addison South,Coyote Logistics,2543 W Diversey Av,"Coyote Logistics, LLC",1051,"Located in Logan Square community area, Coyote Logistics leased and occupied 65,000 square feet within the recently rehabbed Green Exchange.   Coyote Logistics, a high-tech third-party logistics company, relocated their corporate headquarters from Lake Forest, IL to the City for a minimum of ten years.",9/14/10,2000000,6649745,1158733.467,1918472.379,41.93202533,-87.69209153,"(41.93202532590414, -87.6920915287591)",1,23,22535,240,40,24
1802,47th/King Drive,Cuisine Of The Diaspora,300 E 51st St,Urban Junction Inc,809,"Cuisine of the Diaspora, located in Grand Boulevard community area, includes a rehabilitation of a white terra cotta-clad retail building in a variety of culinary venues.  The 17,000 square foot building will include three restaurants, a produce store, and a community garden across the street.",11/10/09,3000000,8108000,1178923.597,1871307.496,41.8021638,-87.61933792,"(41.80216379950666, -87.619337915316)",10,4,21192,449,9,12
12821,Stony Island Commercial/Burnside Industrial,Montclare Senior Residences of Calumet Heights,9401 S Stony Island Av,"MR Properties, LLC",,"A Planned Development and new construction of a 7 story building, including 134 units of senior housing, of which 101 units are affordable to seniors at or below 60% AMI.   The underlying zoning for this project is proposed to be B3-3 to accommodate the senior units as well as two commercial outlots, slated for restaurant uses.  The overall 5.5 acre site PD is anticipated to be filed by the developer in the coming weeks (Jan/Feb 2018).",4/10/18,3000000,38347185,1188530.765,1842933.538,41.72407879,-87.58501024,"(41.72407879107746, -87.58501023762763)",25,44,21202,492,35,9
502018,Foster and California,Swedish Covenant Hospital ER/Women's Floor Rehab,5145 N California Av,Swedish Covenant Hospital,,"Women's Health Care Center:
SCH plans to expand and enhance clinical services by removing access barriers for women of every ethnic and religious group.  The anchor for this initiative is building the Mayora Rosenberg Women's Health Center on the 4th floor of the Galter Medical Pavilion.  The 4th floor will be totally redone to provide more than 13,000 square feet for a Women's Health Center, a Resource Center, and outpatient Cardiology Center for Women, and class and conference rooms  A new women's health center provides the opportunity to centralize in one area all services for women, provide an all­ female staff and women only patient areas, scheduling with evening and weekend appointments, child friendly areas, bilingual staff and bi-lingual educational health care resource materials.

Emergency Department:
Emergency Department Renovation will consist of a ""gut rehab"" of approximately 14,603 square feet on the 1st floor of the East Wing building.  Specific improvements include 15 private large rooms for trauma cases, 5 dedicated psychiatric rooms, 12-bay fast track private exam areas, new post-exam common waiting area, private consultation room, new pharmacy work station, new physician/nurse work station, and improvements to the infrastructure that serves the emergency room (e.g. elevators, mechanical systems, communications, and restrooms).",3/11/14,4600000,18397806,1156802.944,1934240.757,41.97533414,-87.69875688,"(41.97533413581096, -87.69875687452328)",20,6,21849,28,24,46
1038,LaSalle Central,JMC Steel,227 W Monroe St,JMC,1111,"Located in the loop, JMC Steel  leased approximately 29,080 square feet of commercial office space.  The project includes the build-out  of the JMC space and the use of the space as the national headquarters for JMC Steel Group, Inc.",9/13/11,840292,4696602,1174532.013,1899833.075,41.88053925,-87.63459246,"(41.88053924995021, -87.63459246351388)",46,38,14914,92,36,48
11029,Sanitary and Ship Canal,National Wine Spirits,2550 W 35th St,"NWS, Inc",,"The project includes rehabilitation of two existing buildings, totaling 680,000 square feet, for use as warehouse, distribution and office facility.",1/12/93,4460000,14160000,1159688.873,1881410.762,41.8303052,-87.68960213,"(41.83030519677572, -87.68960212772984)",43,55,22248,638,1,29
11097,Humboldt Park Commercial,LaCasa Norte,3533 W North Av,"LaCasa Norte, Inc.",,"25-unit permanent supportive housing for homeless and near homeless youth and families.  All units will be for individuals and families at 30%AMI or below.  Rents will be $786 for the studios, $882 for the one-bedrooms and $1047 for the two-bedroom apartments. The five-story building, 51,238 sq. ft,  will have three floors of residential units--7 studios, 9 one-bedrooms and 9 two-bedrooms and two floors of supportive services, a Federally Qualified Health Clinic, and admin. offices.   The building will seek LEED Gold certification.",1/12/16,3500000,17223500,1152358.007,1910361.089,41.9098957,-87.71573523,"(41.9098957006716, -87.71573522860055)",5,24,22535,422,49,10
1362,River West,Metra Market,117 N Clinton St,"MetraMarket of Chicago, L.L.C., and Ogilive Transit Center Investor, Inc.",199,"The project includes rehabilitation of  approximately 200,000 square feet of retail shopping center.  Within the space, there will be restaurants, retail, a fresh food market, and 100 parking spaces.",3/8/05,12000000,43649000,1172749.081,1900987.419,41.88374649,-87.64110498,"(41.88374649180804, -87.64110497582169)",45,29,4452,784,36,22
11085,Jefferson Park,IGA - CTA - Blue Line Modernization - Your New Blue - Jefferson Park,4915 N Milwaukee Av,Chicago Transit Authority,,"Renovation of CTA Blue Line Jefferson Park station in order to highlight its significant function as an intermodal facility serving CTA, Metra and Pace riders.",3/18/15,5000000,25000000,1139467.069,1932225.754,41.97013948,-87.762557,"(41.970139483650314, -87.76255700293792)",48,11,21869,129,50,20
10964,Near South <Central Station,IGA - CBE - Jones - HS III,603 S State St,Chicago Public Schools,,"This project is to renovate the existing Jones Academic High School building in order to increase the campus capacity to 1,770 students. This project will renovate the existing building built in 1967 for use by Jones Academic High School students. The renovation consists of exterior improvements including a new roof, brick and concrete work, and exterior painting as well as a walkway between the new construction and the existing building. Interior improvements to facilitate the educational programs, to comply with ADA and other safety related compliance, and interior painting are also included in the scope. New lighting, upgraded wireless connectivity, improved security and public address systems, correction of HVAC deficiencies, electrical power improvements, and plumbing improvements are also proposed.",11/5/14,8700000,8700000,1176491.697,1897644.91,41.87449079,-87.62746285,"(41.87449078973808, -87.62746284608279)",35,38,14913,367,10,48
1410,Edgewater,Edgewater Broadway Plaza,5227 N Broadway,First National Realty & American National,277,"Located in the Edgewater community area, the project includes the construction of three 1-story buildings totally 52,000 square feet of space and one outlot for use as a multi-tenant retail mall.",1/30/90,1100000,5900000,1167406.93,1934983.691,41.9771506,-87.65974096,"(41.97715059869084, -87.65974096289457)",15,76,22616,160,16,40
11030,Ogden/Pulaski,Montclare SLF - Lawndale,4339 W 18th Pl,"Montclare Senior Residences SLF of Lawndale, LLC",,"The project will provide 120 housing units of which 108 units or 90 percent will be affordable for households earning no more than 60 percent of the area median income. The project is a supportive living facility that will provide housing and supportive services for seniors ages 65 and older. The goal is to create a contemporary, vibrant and healthy living environment for
seniors.",3/10/15,2000000,27607047,1147554.657,1890603.264,41.85577153,-87.7338879,"(41.85577153130276, -87.7338878999525)",57,30,21569,753,14,36
1317,Devon/Sheridan,Loyola U - Lakeshore,1032 W Sheridan Rd,Loyola University Chicago,122,"Located in the Rogers Park community, the project will rehabilitate buildings at Loyola University's Lake Shore Campus which include interior and exterior renovation of Mundelein Center, Piper Hall, Coffey Hall, and Flanner Hall.  The project will also include streetscape infrastructure improvements along Sheridan Road.",9/13/05,20400000,85000000,1167927.906,1942706.519,41.99833096,-87.65760103,"(41.9983309570758, -87.65760102833097)",9,10,4451,267,5,3
1009,83rd/Stewart,Chatham Market,8300 S Stewart Av,"W2005 CMK Realty, L.L.C.",15,"Located in Auburn Gresham community area, the project includes construction of a 450,000 square foot retail shopping center .  The project also consists of site remediation, 1,750 parking spaces, and public improvements to roads and utilities.",5/12/98,26100000,81933000,1175031.318,1849860.314,41.74339816,-87.63425177,"(41.743398157880364, -87.63425177445762)",59,70,21554,529,13,18
1270,Howard/Paulina,Howard Theater,1615 W Howard St,Howard Theater Limited,58,"Located in the Rogers Park community area, the project includes the rehabilitation of the Howard Theater into 40 affordable rental units and 10 commercial storefront spaces.  The 30,000 square feet of residential space will also include elevator accessibility for a portion of the units.",9/9/97,878200,3790000,1163945.959,1950306.208,42.01926996,-87.6720333,"(42.01926995801616, -87.6720332966243)",9,10,21853,489,5,3
1235,71st/Stony Island,Starbuck's - Stony Island,7101 S Stony Island Av,"BMG Stony Island, LLC",9,"The project will construct a free-standing Starbucks Coffee Company store of 1,626 square feet.  In addition to in-store seating, this Starbucks store will have a drive-through service window and an outdoor seating area.  On site parking will be provided for 13 cars and 6 stacking spaces are provided in the drive-up lane.",5/13/03,225000,1400000,1188190.188,1858184.44,41.76593686,-87.58577242,"(41.76593685872762, -87.58577242335306)",24,39,22538,452,33,32
500068,Englewood Neighborhood,Hope Manor II Apartments,6002 S Halsted St,Volunteers of America of Illinois,,"The Hope Manor II Apartments project is located in the Englewood Neighborhood TIF District. The project consists of the construction of 73-units of affordable rental housing for homeless or near-homeless veterans and their families. The development will consist of five townhome units, six, six-flat buildings, and one, three-story structure, with unit sizes ranging from one- to four-bedrooms.  .",10/29/12,3000000,23453924,1171959.565,1864993.894,41.78499449,-87.64506315,"(41.784994493904904, -87.64506314485939)",11,66,21559,22,2,19
1309,Goose Island,Wrigley Innovation Center,1132 W Blackhawk St,Wm. Wrigley Jr. Company,112,"The project includes the construction of 150,000 square foot ""Innovation Center"".  The building will include a 58,000 square foot laboratory and a 33,000 square foot research pilot plant.",8/13/02,15000000,84330000,1168406.483,1909521.74,41.90726025,-87.65680417,"(41.90726025271137, -87.65680417252435)",49,37,22620,108,46,16
1025,Stony Island Commercial/Burnside Industrial,Finkl Steel,1355 E 93rd St,A. Finkl & Sons Co.,758,"Finkl Steel relocated from the north side location to the Burnside community.  The facility consists of eight existing structures which amount to a total of approximately 500,000 square feet.  The overall site is approximately 60 acres in size.",4/12/11,22500000,150000000,1186966.767,1843550.052,41.72580774,-87.59071954,"(41.72580773793058, -87.59071954121139)",61,43,21546,472,35,9
1614,Western/Ogden,IGA - CBE - Orozco - MS,1940 W 18th St,Chicago Public Schools,935,An intergovernmental agreement between the City of Chicago and the Chicago Board of Education.,5/13/09,250000,481148,1163539.274,1891453.147,41.85778248,-87.67519253,"(41.85778247870229, -87.67519253027801)",43,33,14920,366,26,8
1603,53rd Street,Harper Court Redevelopment,5211 S Harper Av,Harper Court Partners LLC,906,"Located in the Hyde Park community, the Harper Court redevelopment project consists of 150,000 square feet of office space, approximately 100,000 square feet of retail space, and 435 parking spaces.  The ground floor retail space will be leased to Chicago-based and national restaurants, entertainment, and apparel uses.  The project will also feature a heath club adding significant daytime and evening traffic to support the retail.",9/14/10,20045000,111888037,1187217.296,1870857.372,41.80073555,-87.58893622,"(41.800735550150485, -87.58893621765584)",10,8,21192,500,10,1
13420,Canal/Congress,Canal Street Viaduct and Plaza Improvements,433 W Van Buren St,"601 W Companies Chicago, LLC",,The reconstruction of the existing S. Canal Street viaduct between W. Van Buren Street and W. Harrison Street.  Additional work includes the construction of a new public plaza in the public right-of-way adjacent to the Old Post Office Building.,9/20/18,18000000,18000000,1173294.77,1898412.055,41.87666743,-87.63917766,"(41.876667432354196, -87.63917766411434)",44,29,14917,97,26,48
11049,Near South <Central Station,IGA - CPD - Park Women's Park,1620 S Indiana Av,Chicago Park District,,An intergovernmental agreement between the City of Chicago and Chicago Park District.,3/6/13,3800000,3800000,1177884.113,1892279.175,41.85973536,-87.6225137,"(41.859735354839444, -87.62251369847576)",40,34,21194,374,9,48
500091,Midwest,Harvest Homes,3570 W Fifth Av,"Harvest Homes Apartments, L.P",,"Harvest Homes will consist of new construction of 36 affordable, multi-family rental units, which will be comprised of four, three-story walk-up buildings in the East Garfield Park community area.  The development will offer one-to-four bedroom apartments and will be targeted to families with household incomes between 30% and 60% of the area median income.  Of the 36 apartments, eight will be handicapped accessible.  There will be 36 parking spaces; eight of which will be handicapped accessible.",12/9/14,1039544,13116453,1152467.667,1897941.688,41.87581346,-87.71566082,"(41.87581345863129, -87.71566081634818)",30,28,21572,783,23,11
1277,Roosevelt/Canal,Soo T,1200 S Canal St,"Soo T, LLC",65,"Located in the Near West Side community area, the project includes the construction of a 98,000 square foot retail shopping center including a supermarket and additional retail space.",1/29/97,4500000,20349361,1173268.771,1894952.635,41.86717513,-87.63937581,"(41.86717512472001, -87.63937581258092)",44,29,14917,97,48,48
1740,Jefferson Park,IGA - CPD - Park 0145 - Wilson,4630 N Milwaukee Av,Chicago Park District,2055,"New playground at 4630 North Milwaukee Avenue, Chicago, Illinois with poured-in place rubberized surfacing, age-appropriate equipment, swings, landscaping, fencing, lighting, paving, and site furnishings. The requested $500,000 in TIF funds includes park design, demolition, drainage, utilities, remediation, earthwork, construction, and related activities.",8/23/11,500000,500000,1140651.776,1930281.625,41.96478289,-87.7582487,"(41.96478288558495, -87.75824870012931)",48,15,21869,260,50,20
1680,Hollywood/Sheridan,IGA - CPD - Park 0385 - Buttercup,4901 N Sheridan Rd,Chicago Park District,1072,"An intergovernmental agreement between the City of Chicago and the Chicago Park District for the overall park development, design and build new ADA accessible playground and spray feature.",4/13/11,1000000,1000000,1168782.86,1932996.779,41.97166866,-87.65473895,"(41.971668654968134, -87.65473895412312)",15,31,22616,635,16,40
12424,35th/Wallace,IGA - CBE - McClellan Elementary - Interior Improvements & Athletic Development,3527 S Wallace St,Chicago Public Schools,,"This is an intergovernmental agreement between DPD and CPS to use TIF financing to fund rehabilitation improvements to McClellan Elementary School. 

The project is located in the Bridgeport neighborhood. 

The project was completed in the December of 2018. The project:
--constructed an exterior elevator addition connecting all four floors
--added accessible toilets. 
--re purposed classroom and cafeteria space to increase capacity   
--built a new track and field with lighting. 
--expanded the school property 75 feet to south by purchasing To do so three adjacent residential lots 

The $4,000,000 project will be paid for entirely with TIF funding.",6/27/18,4000000,4000000,1172917.689,1881398.625,41.82998962,-87.64106579,"(41.829989616224736, -87.64106578961876)",37,58,14924,172,48,26
11100,Near North,IGA - CBE - Walter Payton HS Annex,1034 N Wells St,Chicago Public Schools,,An intergovernmental agreement between the City of Chicago and Chicago Board of Education for construction of a three story addition to Walter Payton High School.,9/24/14,20000000,20000000,1174484.638,1907490.082,41.90155157,-87.63453745,"(41.90155156567868, -87.63453744491137)",54,37,14926,148,46,41
