ID,TIF DISTRICT,PROJECT NAME,ADDRESS,DEVELOPER,PROJECT ID,PROJECT DESCRIPTION,CDC DATE,APPROVED AMOUNT,TOTAL PROJECT COST,X COORDINATE,Y COORDINATE,LATITUDE,LONGITUDE,LOCATION,Boundaries - ZIP Codes,Community Areas,Zip Codes,Census Tracts,Wards,:@computed_region_awaf_s7ux
1432,Stockyards SEQ,Luster Products,1104 W 43rd St,Luster Products,303,"Located in New City community area, the project includes construction of a 160,000 square foot manufacturing and distribution facility.",11/10/92,5000000,12705022,1169602.725,1876324.927,41.81613954,-87.65337569,"(41.81613954423259, -87.65337568742791)",37,59,14924,123,48,26
11066,Midwest,IGA - Garfield Park Dome,120 N Central Park Dr,Chicago Park District,,"An intergovernmental agreement between the City of Chicago and Chicago Park District. The project includes restoration of the Gold Dome roof, masonry, historic terra cotta, vaulted veranda, stairways, ramps, and miscellaneous interior repairs.",6/3/14,2500000,2500000,1152350.443,1900796.913,41.88365081,-87.71601582,"(41.88365081237322, -87.71601581859323)",30,28,21572,176,23,11
1398,Chinatown Basin,Chinatown Square,2133 S China Pl,Chinese-American Development Corp.,261,"Located in Armour Square, the project includes construction of 280 townhouses and condos, 56 retail and office units, open air mall and plaza, 100,000 square foot Asian trade center, 200 room hotel, community center, 150 units senior housing, improvements to roads, utilities, and landscaping.",5/9/90,7298000,30762115,1174606.142,1890103.222,41.85383822,-87.63461107,"(41.853838221618524, -87.6346110667436)",40,35,21194,3,26,8
1365,Roosevelt/Homan,Roosevelt Towers I - Senior,3440 W Roosevelt Rd,"Roosevelt Tower - I, LLC",203,"The project includes construction of 126 affordable senior units which will be 60% area median income.  The apartment building will have 6 and 8 story wings and include 33 parking spaces.  The building to be located at 3440 West Roosevelt Road, Chicago, Illinois. The 126 units in the project financed with HOME funds are required to be occupied by low-income families.",7/10/01,1540433,18562300,1153440.124,1894532.775,41.86643977,-87.71218086,"(41.86643977129227, -87.71218086033134)",30,30,21572,98,14,36
1274,Central Loop,Dearborn Center,123 S Dearborn St,Dearborn Center LLC,62,"Located in the Loop, the project includes construction of 1.5 million square feet 37-story building and 11-story low-rise building for retail and office.  The building includes 200 space parking garage and 98,000 square feet of retail space.",5/9/00,10000000,337200000,1175998.147,1899667.126,41.88005099,-87.62921402,"(41.88005099434822, -87.62921401451015)",34,38,14311,92,36,22
11594,Woodlawn,IGA-CBE-Wadsworth ES,6650 S Ellis Av,Chicago Public Schools,,"Intergovernmental Agreement with the Board of Education of the City of Chicago in order to provide Tax Increment Financing (TIF) funds to reimburse the Chicago Board of Education for the costs associated with campus wide site improvements 			that will include improvements to the storm water retention system at James Wadsworth Elementary School (Wadsworth). 

The Wadsworth improvements are part of the Space to Grow program, an innovative program to transform Chicago School yards into spaces that provide students, their families and the broader community with the opportunity for active play, space for physical education classes, opportunities for outdoor learning, gardening and environmental literacy, and engagement with art. 

This project is being done in conjunction with the Department of Water Management and Metropolitan Water 			Reclamation District.",9/24/15,500000,500000,1183997.399,1860905.944,41.77350389,-87.60105531,"(41.773503889811025, -87.6010553110708)",60,9,22260,347,33,32
1280,Canal/Congress,Quaker Oats,555 W Monroe St,Monroe Clinton LLC,70,"The project consists of construction of a 17-story, 450,000 square foot office building for use as Quaker Oats' headquarters including 15,000 square feet of retail space.",3/14/00,11000000,88381685,1172558.891,1899783.807,41.88044791,-87.64183898,"(41.88044790879155, -87.64183897534404)",45,29,4452,786,36,48
1248,Chatham Ridge,Havens - 87th Parnell,8505 S Parnell Av,Lakeshore 87th St Homes L.P.,32,"Located in Auburn Gresham, the project includes construction of 99 single family residential units.  The project consists of site preparation, infrastructure improvements, and reconstruction of Parnell Avenue from 83rd to 87th Street.",6/12/01,7190000,28845118,1174154.72,1848406.898,41.7394293,-87.63750673,"(41.73942929482598, -87.63750672915647)",59,70,21554,529,13,18
11635,Central West,McCrory Senior Apartments,1637 W Washington Bv,"Brinshore Development, LLC",,"Located in the Near West Side community area, the project includes construction of a five-story rental affordable building for seniors. The project will provide 62 housing units of which 7 units or 11 percent will be affordable for households earning no more than 30% percent of the area median income and 55 units or 89 percent will be affordable for households earning no more than 60% percent of the area median income. Donation Tax Credits are IHDA.",5/10/16,4100000,17526863,1165323.057,1900716.695,41.88316474,-87.66838158,"(41.88316473822715, -87.6683815808488)",28,29,21184,90,46,41
13403,Clark/Montrose,IGA - CPD - Chase Park Athletic Field,4701 N Ashland Av,Chicago Park District,,"The Chicago Park District will construct a new artificial turf athletic field, upgrade
an existing fieldhouse with a new roof and mechanical repairs, and to make additional field
improvements which will include lighting, drainage, seating, fencing, and landscaping.",11/14/18,3000000,3000000,1164849.038,1931317.833,41.96714616,-87.66925195,"(41.96714615669716, -87.66925195138536)",15,31,22616,559,18,13
1642,Madison/Austin Corridor,IGA - CBE - HS - Austin - II,231 N Pine Av,Chicago Public Schools,1024,"The renovation of existing schools includes ADA upgrades, science lab upgrades, building
envelope and interior finish work, exterior and landscape improvements in order to bring the
school facilities up to the latest Board renovation standards.",5/12/10,5570000,37575847,1139494.763,1901274.258,41.88520477,-87.76321191,"(41.88520477035911, -87.76321191112676)",32,26,22216,674,45,11
13200,Stevenson Brighton,4800 S Western - Park District HQ,4800 S Western Av,Chicago Park District,,"Located in Brighton Park Community Area, the Chicago Park District is acquiring 17 acres of vacant property at 4800 S Western Avenue to: (1) create new park space in a top 5 park under served community area, and (2) location of new Park District headquarters.",12/12/18,8650000,8650000,1161140.155,1872770.422,41.80656511,-87.6845167,"(41.806565108313976, -87.68451669652315)",56,55,22248,85,8,29
1462,47th/Ashland,Park Federal Savings Bank,1821 W 47th St,Park Federal Savings Bank,414,The project will include construction of a 2-story bank including a drive up with parking and ATMs.  The building will have a green roof of 50% of the net roof area.,12/13/05,850000,5002670,1164874.947,1873481.813,41.80843907,-87.67079859,"(41.80843906490185, -87.67079858618521)",37,59,14924,709,3,53
1605,Addison South,Green Exchange,2546 W Diversey Av,"Gx Chicago, LLC",908,"Located in the Logan Square community, the project will rehabilitate a 272,000 square foot building as multi-tenant space.  The project is designed for the advancement of ""green"" business by bringing together a mix of organizations focused on green business under one roof and and allowing those organizations to grow.  The project will provide a retail presence, light industrial/manufacturing, product assembly, office space, work-live spaces, exhibit space, and common areas.",12/8/09,10000000,52750742,1158690.125,1918551.759,41.93224404,-87.69224862,"(41.93224404049072, -87.69224862153072)",39,22,21538,467,20,24
1041,Western/Rock Island,Home Run Inn,10900 S Western Av,"CP MOK Properties, LLC.",1150,"The streamlined TIF request was for the construction of a 4,500 square foot commercial facility with approximately 20 parking spaces that be leased out to Home Run Inn Pizza. The project will create 35 permanent jobs (10 full-time and 25 part-time) and approximately 50 temporary construction jobs.",8/9/11,350000,1556995,1162292.764,1832249.723,41.6953463,-87.68141536,"(41.69534630027884, -87.68141535642928)",33,74,22212,314,42,33
10987,Wilson Yard,Wilson Yard,1035 W Montrose Av,"Wilson Yard Development I, LLC",,"Located in the Uptown community, the project demolished two buildings to construct a 180,000 square foot Target department store, 15,000 square foot Aldi grocery store, senior housing, low-income housing, additional retail, and 555 parking spaces.

The Low Income Project shall mean the 98 units financed with HOME funds and required to be occupied by Low Income families.",9/14/04,54228392,162752711,1168391.685,1929341.324,41.96164646,-87.65628357,"(41.961646462011565, -87.65628356888453)",53,31,21186,577,39,37
500242,Stony Island Commercial/Burnside Industrial,Dixon Park (4007),8701 S Dauphin Av,Chicago Park District,,"Lorraine Dixon Park is located at 8701 S Dauphin Street. 
 
Alderman Harris is requesting $1M from the Stony Island TIF for improvements to this park, which include a new park entry / garden, path improvements, and playground replacement to meet current Park District standards.    
 
Total cost of the project is $1M.   (Reimburse at $200k per year for 5 years) 
 
Uses Budget: 
Park entry plaza with gardens            $120,000 
Walkways, landscaping, lighting         $230,000 
New playground and spray feature    $440,000 
Survey and permits                              $10,000 
General construction                          $100,000 
Design                                                    $100,000 
Total =                                                   $1,000,000 
 
This project is identified in the 2012 - 2016 Park District Capital Improvement Plan.",12/31/13,350000,725000,1184114.066,1847472.338,41.73663799,-87.6010468,"(41.73663799170645, -87.60104679870054)",61,40,21546,429,35,9
13090,Peterson/Cicero,Peterson Cicero - Sauganash Place Whole Foods,6020 N Cicero Av,"Peterson Cicero, LLC",,"Located in the Forest Glen community, the project includes construction of two separate buildings containing approximately
40,405 square feet of commercial space and approximately 136 condominium units, including 27 affordable units.",9/28/04,10300000,63689644,1143245.244,1939669.138,41.99049477,-87.74847741,"(41.990494771830264, -87.74847741422931)",18,12,22532,782,38,28
1487,111th/Kedzie,Mt Greenwood Walgreens Center,3200 W 111th St,Gendell Partners,599,The project is located in the 111th Kedzie TIF district. The project consists of the redevelopment of the 1.9 acre site at the northwest corner of 111th and Kedzie into a two building of a Walgreens-achored retail center with 73 cars parking lot.,2/19/08,1500000,10733092,1156983.393,1830872.988,41.69167691,-87.7008919,"(41.69167691352474, -87.70089190059177)",33,73,4447,369,42,33
11728,24th/Michigan,IGA - CBE - 2300 S. Dearborn,2300 S Dearborn St,Chicago Public Schools,,Reimburse the Chicago Board of Education for the construction of an athletic field and improvement.,1/13/16,4600000,4600000,1176314.713,1889071.168,41.85096787,-87.62837113,"(41.85096786933982, -87.6283711302595)",40,34,21194,193,9,12
1298,47th/Ashland,Bishop Plaza,4626 S Bishop St,"Bishop Plaza, L.L.C.",99,"The project consists of redevelopment of the former site of Bishop Plaza Shopping Center that previously included a Jewel grocery store and a gas station service station.  The project will rehabilitate a 56,000 square foot building, constructing a 6,000 square foot building, environmental remediation of the former gas station, and redesign of the current parking lot.",10/14/03,2200000,10240542,1167410.504,1873941.487,41.80964645,-87.66148556,"(41.809646446414675, -87.66148556130851)",37,59,14924,123,3,12
12860,43rd/Cottage Grove (DOH),45th Cottage Grove - Phase 1,4400 S Cottage Grove Av,Brinshore Development,,"4400 Grove is the first phase of the redevelopment of the former Washington Park Homes site, and a CHA Plan Forward site (formerly the Plan for Transformation).  Phase I is the new construction of 84 units in two four-story buildings with ground floor commercial/retail space. 59 units (70% of total units) will be affordable for households earning no more than 60% AMI, and the remaining 25 will be market-rate.",7/10/18,7200000,36999274,1182295.45,1875978.517,41.81490392,-87.60682726,"(41.81490392424132, -87.6068272642158)",36,4,4301,161,10,1
1326,Central Loop,Metropolitan Allegro Bldg,171 W Randolph St,"Palmet Venture, LLC",140,"Located in the Loop, the project includes renovation of an existing hotel, theater, office building.  The building includes a 483 room hotel with two restaurants, renovation of the lobby,  meeting spaces.  The project also renovates ""Palace Theater"" as 2,350 seat theater, expands the stage,  meets ADA requirements, upgrades mechanical, electrical, plumping, sidewalk improvements, and facade improvements.",7/8/97,17600000,77700000,1174909.505,1901229.207,41.88436188,-87.63316454,"(41.88436187748195, -87.63316453760919)",41,38,14310,92,36,22
1602,Chicago Lakeside Dev - Phase 1 (USX),South Works - McCaffery,8101 S Brandon Av,"Chicago Lakeside Development, LLC",894,"The South Works McCaffery project is located in the Chicago Lakeside Dev - Phase 1 (USX) TIF District. The project is a mixed-use development consisting of a single tower with 250 residential rental units. In addition, the project contains 136 affordable units for sale and 3 high-rise buildings with 598 units. Infrastructure and utility work is also included.",5/11/10,96859748,396693757,1198930.774,1851841.714,41.7482691,-87.54661793,"(41.74826910082423, -87.54661793436554)",25,42,21202,505,37,43
1390,Central Loop,Mentor Bldg,6 E Monroe St,"Mentor Building, L.L.C.",248,"Located in the Loop, the project includes rehabilitation and renovation of an existing office building as residential, retail, and office space.  The building will include the first two floors as retail space, 40-50 condominiums, office space, and fitness center on remaining floors.The project also restores the building's facade.",6/22/99,2500000,11506161,1176457.48,1899972.312,41.88087809,-87.6275182,"(41.88087809052511, -87.62751820292168)",34,38,14311,367,36,22
1418,Near South <Central Station,Roosevelt Hotel,1152 S Wabash Av,"Roosevelt Hotel, LLC",286,"Located in the Loop, the project includes the complete rehabilitation and renovation of an existing building into 42 residential units including 20% affordable units and 3,400 square feet of retail space.",6/27/00,2350000,8140042,1176916.222,1895171.633,41.86769438,-87.62597903,"(41.86769437811391, -87.62597902749147)",35,38,14913,368,10,48
10742,Calumet Cermak,IGA - MPEA - HOTEL,2121 S Prairie Av,Metropolitan Pier and Exposition Authority,,Intergovernmental agreement with Metropolitan Pier and Exposition Authority concerning construction and rehabilitation of property at approximately 2121 S Prairie Ave.,3/5/14,55000000,421500000,1178441.925,1890066.48,41.85365089,-87.62053358,"(41.853650885040594, -87.62053358114167)",40,34,21194,374,9,48
1721,Englewood Neighborhood,IGA - CBE - ADA - Banneker,6656 S Normal Av,Chicago Public Schools,1156,An intergovernmental agreement between the City of Chicago and the Chicago Board of Education regarding accessibility improvements.,4/13/11,2000000,2213070,1174114.357,1860550.724,41.77275434,-87.63729464,"(41.77275433457042, -87.6372946372389)",11,66,21559,435,32,31
1807,35th/State,IIT / Townsend Development,3440 S Dearborn St,"Townsend Chicago, LLC",19,"The project consists of a 126,000 square feet rehabilitation of office/institutional space into flexible research/office space, used to house tech business incubators.  The building is in the former Chemical Research Building on  IIT campus.",6/14/05,13400000,13400000,1176492.717,1882013.261,41.83159643,-87.62793058,"(41.831596425369504, -87.62793057725152)",40,1,21194,25,9,12
1509,Harrison/Central,Loretto Hospital,645 S Central Av,Loretto Hospital,626,"Located in the Austin community, the project consists of expanding and renovating the existing Emergency Department (ED) and Main Lobby / Entrance on the first floor of the hospital building. Both areas occupy the east end of the 1969 addition to the Hospital and will require multi-phased construction to maintain the 24/7 occupancy. The approximately 4,375 square feet ED building addition will be located on the east side of the hospital at the first floor as a one-story portion. Parking will be expanded and reconfigured to provide for better on-site traffic and patient flow.  New larger entrance canopies will afford much needed protection and separation for patients, staff and vehicles.",11/14/06,7500000,23952000,1139194.668,1896491.518,41.87208577,-87.76443035,"(41.87208576989947, -87.76443034735553)",32,26,22216,61,7,52
11722,Belmont/Central,IGA - CBE - Belmont-Cragin Elementary,5252 W Palmer St,Chicago Public Schools,,"Intergovernmental Agreement with the Board of Education of the City of Chicago in order to provide Tax Increment Financing (TIF) funds to reimburse the Chicago Board of Education for the costs associated with the planning, design, and construction of a playground for children 2-12 years old at Belmont Cragin Elementary School located at 5252 W. Palmer Street.",1/13/16,287000,287000,1140773.188,1914158.944,41.92053845,-87.75820003,"(41.920538446762095, -87.75820002999474)",2,19,22615,307,44,4
1408,Eastman/North Branch,Essanay Studio Lighting,1346 N North Branch St,Essanay Studio & Lighting Co.,275,"Located in the Near North Side community, the project includes construction of a sound stage production facility.  The project consists of demolishing part of an existing building, rehabilitating the remaining 10,000 square foot structure, and construction of two additions totally 26,000 square feet.  There are two sound stages, offices, warehouses, and conference areas within the building.",5/9/95,394000,2922000,1168433.481,1909011.171,41.90585864,-87.65671979,"(41.905858635728926, -87.65671979400794)",49,37,22620,108,46,16
1452,Read/Dunning,Alter Group,6800 W Irving Park Rd,"The Alter Group, Ltd",383,Develop property for light industrial use.,1/21/92,300000,300000,1130321.152,1925866.847,41.95285225,-87.79633414,"(41.95285224503831, -87.79633414419206)",52,17,22254,442,19,25
11593,63rd/Ashland,IGA-CBE-Earle,2040 W 62nd St,Chicago Public Schools,,"Intergovernmental 	Agreement with the Board of Education of the City of Chicago in order to provide 	Tax Increment Financing (TIF) funds to reimburse the Chicago Board of Education 	for the costs associated with the planning, design, and construction of a new play lot 	for children 2 to 12 years old at Charles W. Earle Elementary School (Earle).",9/24/15,287000,287000,1163653.744,1863565.274,41.78125258,-87.67555599,"(41.78125258360491, -87.67555599128305)",23,65,22257,274,2,44
11044,63rd/Ashland,IGA - CBE - Lindblom Academy additional,6100 S Winchester Av,Chicago Public Schools,,"Lindblom Academy Parking Lot, Additional Funding",8/5/14,1600000,2100000,1164364.228,1864173.166,41.78290578,-87.67293408,"(41.78290577596, -87.6729340773917)",23,65,22257,275,2,44
10447,Galewood/Armitage Industrial,IGA - CPD - Amundsen Park,6200 W Bloomingdale Av,Chicago Park District,,An intergovernmental agreement between the City of Chicago and Chicago Park District.,6/3/14,2850000,2850000,1134782.765,1911356.237,41.91295562,-87.78027681,"(41.91295561718631, -87.78027681122344)",2,26,22615,597,7,52
11879,Bronzeville,Quad Communities  Arts and Recreation Center,435 E 35th St,Community Builders Inc.,,"The proposed project is a 30,000 square foot athletic, recreational, arts, educational and
community facility next to the Oakwood Shores CHA transformation project. The Chicago Park
District will operate and lease the facility. After 7 years, the building will be transferred to the
Chicago Park District permanently. 
The Chicago Park District and Chicago Public Schools will transfer land to the City, who will then
lease it to The Community Builders under a 19-25 year lease, and finally the Chicago Park
District will sublease the land from The Community Builders.",9/9/14,4300000,17567328,1179871.25,1881847.581,41.83106499,-87.61553962,"(41.83106498840861, -87.61553962138639)",36,1,4301,561,10,1
10436,Central West,IGA-CBE-Crane,2245 W Jackson Bv,Chicago Public Schools,,"This project includes the planning, design, and construction of a new artificial turf field to
replace an existing natural turf field, sports field lighting, and a latex coated HMA running
track. The project includes all necessary sub-surface infrastructure for drainage and
electrical systems as well as accessibility improvements.",2/4/14,2250000,2340050,1161290.138,1898611.918,41.87747384,-87.68324922,"(41.877473837668695, -87.68324922237663)",28,29,21184,89,46,48
1420,Near South <Central Station,Lakefront SRO - Wabash,1521 S Wabash Av,South Loop L.P. and Lakefront Single Room Occupancy Corp.,288,"The project includes the construction of 207 unit residential building for low and middle income tenants.  The project will also consist of parking facilities, job training center, and landscaping on adjacent site.",12/12/95,580500,16833900,1177054.325,1892851.446,41.86132451,-87.62554226,"(41.86132451284019, -87.62554225942642)",35,34,14913,374,9,48
1790,Pershing/King,P G Stewart - Tower 5 - Rehab,460 E 41st St,Paul G. Stewart Apartments Associates Phase V L.P.,2243,The P. G. Stewart Tower 5 project is located in the Pershing/King TIF District. The project consists of the rehabilitation of an 11-story building containing 97 affordable one-bedroom units.,6/10/11,2500000,18320288,1180219.199,1877957.214,41.82038154,-87.61438244,"(41.820381543450885, -87.61438243538622)",36,4,4301,625,9,12
11068,Canal/Congress,IGA - CTA - Bus Rapid Transit - Loop - Canal Congress,620 W Madison St,Chicago Transit Authority,,An intergovernmental agreement between the City of Chicago and Chicago Transit Authority.  -IGA pending,12/1/14,24802500,37912500,1172070.522,1900322.247,41.88193621,-87.64361632,"(41.88193620918798, -87.64361631603194)",45,29,4452,784,36,22
1611,Wilson Yard,Mercy Housing - Eastwood Sheridan,4946 N Sheridan Rd,Mercy Housing Lakefront; HWA 850 Eastwood LP,923,"Located in the Uptown community, the project will rehabilitate 300 residential units in two buildings. 280 affordable units will have a 60% area median income. 273 of the units are tax credit eligible.",1/12/10,3000000,61259738,1168689.933,1933461.587,41.97294612,-87.65506713,"(41.972946122053244, -87.65506712466981)",15,31,22616,634,16,37
1429,Sanitary and Ship Canal,Hawthorne Campbell Industrial Park,2600 W 35th St,Hawthorne-Campbell Holdings L.P.,299,A redevelopment agreement between the City of Chicago and Hawthorne Campbell Industrial Park.,1/12/93,1271000,1271000,1159564.489,1881406.504,41.83029607,-87.69005861,"(41.83029606803829, -87.69005861348269)",43,55,22248,638,1,29
12090,Division/Homan,IGA - CPD - Humbolt Park Batting Cages,1400 N Sacramento Av,Chicago Park District,,"$325,000 from the Division Homan TIF will be provided to the Chicago Park District to construct new automated batting cages at Humbolt Park.  The batting cages will be made available to the public and free of charge.  

The total cost to construct the batting cages is $656,350.  The remainder of the funds will be provided through the Park District capital program.",3/29/17,325000,656350,1156179.134,1893260.912,41.86289482,-87.70215997,"(41.86289481854531, -87.70215996841996)",57,30,21569,132,14,36
1400,Division/North Branch,River North Distributing,1300 N North Branch St,River North Distributing,263,"The project includes demolishing the existing building and construction of a new building which includes 13,000 square feet of office space, 31,000 square foot refrigerated cooler, 17,000 square foot truck drive through, 5,000 square foot receiving docks, 6,000 square foot ambient area, and parking.  The project also consists of construction of a seawall along Chicago River, environmental clean-up, landscaping, and site work.",2/19/91,2615000,10515900,1168488.125,1908561.596,41.90462379,-87.6565321,"(41.90462379227976, -87.65653209626667)",49,37,22620,108,46,16
10730,Near South <Central Station,IGA - CTA - Red Line Harrison Station Rehabilitation,608 S State St,Chicago Transit Authority,,An intergovernmental agreement between the City of Chicago and the Chicago Transit Authority to provide Tax Increment Financing (TIF) assistance for rehabilitation of Harrison Street rapid transit station on the Red Line.,11/15/12,10000000,10000000,1176412.732,1897603.216,41.87437816,-87.62775403,"(41.8743781602792, -87.62775402746496)",35,38,14913,12,10,48
11038,River West,IGA - CTA - Blue Line Modernization River West,800 W Grand Av,Chicago Transit Authority,,An intergovernmental agreement between the City of Chicago and Chicago Transit Authority. -IGA pending,3/10/14,6500000,63000000,1170936.505,1903723.248,41.89129371,-87.64768059,"(41.891293712960874, -87.6476805930264)",49,25,22620,522,46,41
10620,Midwest,East Park SRO,3300 W Maypole Av,The Habitat Company,,"East Park SRO, located in the East Garfield Park Community area. includes the rehabilitation of a completely affordable 152-Unit SRO apartment building plus 1 Residential Managers Unit. The property serves low and very low income  tenants whose income is at 60% of AMI and below.",6/14/16,5212175,16666443,1154287.339,1900828.13,41.88369802,-87.7089025,"(41.88369802211018, -87.70890250016994)",30,28,21572,176,23,11
